Market,Headline,Signal,Date,Source,Run_Time
Commodities,"Oil prices ease after loadings resume at Russian export hub - Reuters. <a href=""https://news.google.com/rss/articles/CBMiqgFBVV95cUxQOVBNYTdIak9jSTVnY1psQ2VsektWTzZWUm1FcFVXaXFJYXZLOVU2bzlyc09xbWVIZ3p...",🟢 Buy,2025-11-17,GoogleRSS,2025-11-21 20:20:30
Commodities,"Oil prices ease after loadings resume at Russian export hub - Reuters. <a href=""https://news.google.com/rss/articles/CBMiqgFBVV95cUxQOVBNYTdIak9jSTVnY1psQ2VsektWTzZWUm1FcFVXaXFJYXZLOVU2bzlyc09xbWVIZ3p...",🟢 Buy,2025-11-18,GoogleRSS,2025-11-21 20:20:30
Commodities,"Believe It or Not, That $12 Million Gold Toilet Was Bought by … Ripley’s - The New York Times. <a href=""https://news.google.com/rss/articles/CBMigwFBVV95cUxOM1hkeFc1dWZFNXlTMnRBTGNXbnJUR1NhN2RLMG5ocVB...",⚪ Neutral,2025-11-19,GoogleRSS,2025-11-21 20:20:30
Commodities,"White House announces new oil and gas drilling off California and Florida - The Guardian. <a href=""https://news.google.com/rss/articles/CBMioAFBVV95cUxPR3NHd0Nsc1lwRkUyTlZJeW1jUWZzNkRvNUJKclBiMVN4dFFW...",⚪ Neutral,2025-11-20,GoogleRSS,2025-11-21 20:20:30
Commodities,"The One Thing That Could Send Gold Prices Plummeting - MSN. <a href=""https://news.google.com/rss/articles/CBMiygFBVV95cUxOQjlxVTFKcnZyNU1feURCdkp4WXFfRmdzaXVTUDVacWRoazJTUS1KMThLdjIxeVRPOTNtTVBCbDVVR2...",⚪ Neutral,2025-11-21,GoogleRSS,2025-11-21 20:20:30
